{
  "assumptions": [
    {
      "assumption": "The handler's stated data requirements are complete.",
      "operator_id": "first-principles",
      "treated_as": "missing_evidence"
    },
    {
      "assumption": "The identity provider can issue short-lived credentials without a new integration.",
      "operator_id": "systemic",
      "treated_as": "missing_evidence"
    },
    {
      "assumption": "Rejecting the change outright is out of scope for this review.",
      "operator_id": "divergent",
      "treated_as": "missing_evidence"
    },
    {
      "assumption": "The release cadence stays weekly.",
      "operator_id": "second-order",
      "treated_as": "missing_evidence"
    }
  ],
  "authorization": {
    "authorization_id": null,
    "checks": [],
    "derived_from_confidence": false,
    "issuer": null,
    "nonce": null,
    "reason": "an action was requested and no CASA authorization object was supplied",
    "status": "PENDING_CASA",
    "verifier": "unavailable",
    "verifier_is_authentic": false
  },
  "classification": {
    "activated_rule_id": "CL-1",
    "caller_proposal_honored": false,
    "caller_proposal_mismatch": false,
    "caller_proposed_classification": null,
    "classification_policy_id": "RCP-ROUTING-0.1.0",
    "classification_policy_version": "0.1.0",
    "classification_source": "computed",
    "deterministic_basis": "ordered first-match over classification_rules against normalized intake",
    "manual_override": null,
    "manual_override_owner": null,
    "manual_override_reason": null,
    "rejected_classifications": [],
    "task_class": "CHANGE_RISK"
  },
  "confidence_by_operator": [
    {
      "contributes_to_decision_confidence": true,
      "declared_confidence": "high",
      "effective_confidence": 1.0,
      "operator_id": "first-principles"
    },
    {
      "contributes_to_decision_confidence": true,
      "declared_confidence": "medium",
      "effective_confidence": 0.75,
      "operator_id": "systemic"
    },
    {
      "contributes_to_decision_confidence": false,
      "declared_confidence": "low",
      "effective_confidence": 0.0,
      "operator_id": "divergent"
    },
    {
      "contributes_to_decision_confidence": true,
      "declared_confidence": "medium",
      "effective_confidence": 0.75,
      "operator_id": "critical"
    },
    {
      "contributes_to_decision_confidence": true,
      "declared_confidence": "medium",
      "effective_confidence": 0.75,
      "operator_id": "inverted"
    },
    {
      "contributes_to_decision_confidence": true,
      "declared_confidence": "medium",
      "effective_confidence": 0.75,
      "operator_id": "second-order"
    },
    {
      "contributes_to_decision_confidence": true,
      "declared_confidence": "derived",
      "effective_confidence": 0.583333,
      "operator_id": "convergent"
    }
  ],
  "contradictions": [
    {
      "contradiction_id": "RCP-CON-DFP-C1-DCR-C1",
      "detection_method": "Two claims contradict when they address the same subject_ref with opposing polarity. Detection is structural, not semantic.",
      "disposition": "unresolved",
      "disposition_owner": null,
      "opposing_claim_id": "DCR-C1",
      "opposing_confidence": 0.75,
      "opposing_operator": "critical",
      "severity": "material",
      "subject_ref": "OPT-SCOPED",
      "supporting_claim_id": "DFP-C1",
      "supporting_confidence": 1.0,
      "supporting_operator": "first-principles"
    },
    {
      "contradiction_id": "RCP-CON-DSO-C1-DCR-C1",
      "detection_method": "Two claims contradict when they address the same subject_ref with opposing polarity. Detection is structural, not semantic.",
      "disposition": "unresolved",
      "disposition_owner": null,
      "opposing_claim_id": "DCR-C1",
      "opposing_confidence": 0.75,
      "opposing_operator": "critical",
      "severity": "material",
      "subject_ref": "OPT-SCOPED",
      "supporting_claim_id": "DSO-C1",
      "supporting_confidence": 0.75,
      "supporting_operator": "second-order"
    },
    {
      "contradiction_id": "RCP-CON-DSY-C1-DCR-C1",
      "detection_method": "Two claims contradict when they address the same subject_ref with opposing polarity. Detection is structural, not semantic.",
      "disposition": "unresolved",
      "disposition_owner": null,
      "opposing_claim_id": "DCR-C1",
      "opposing_confidence": 0.75,
      "opposing_operator": "critical",
      "severity": "material",
      "subject_ref": "OPT-SCOPED",
      "supporting_claim_id": "DSY-C1",
      "supporting_confidence": 0.75,
      "supporting_operator": "systemic"
    }
  ],
  "convergence": {
    "decision_confidence": 0.583333,
    "decision_confidence_basis": "min(mean supporting claim confidence 0.833333, evidence ceiling 1.0) less contradiction penalty 0.25",
    "decision_confidence_label": "uncalibrated_decision_support_score",
    "ranking": [
      {
        "contradiction_penalty": 0.25,
        "distinct_evidence": 5,
        "evidence_refs": [
          "EV-D2",
          "EV-D3",
          "EV-D4",
          "EV-D5",
          "EV-D6"
        ],
        "evidence_sufficient": true,
        "independent_groups": 5,
        "label": "Merge with a request-scoped short-lived credential",
        "mean_evidence_quality": 80.9091,
        "net": 1.5,
        "opposing_claims": [
          "DCR-C1"
        ],
        "opposition": 0.75,
        "option_id": "OPT-SCOPED",
        "support": 2.5,
        "supporting_claims": [
          "DFP-C1",
          "DSO-C1",
          "DSY-C1"
        ],
        "unmet_thresholds": [],
        "verified_evidence": 7
      },
      {
        "contradiction_penalty": 0.0,
        "distinct_evidence": 3,
        "evidence_refs": [
          "EV-D2",
          "EV-D4",
          "EV-D5"
        ],
        "evidence_sufficient": true,
        "independent_groups": 3,
        "label": "Merge the change as submitted",
        "mean_evidence_quality": 85.0,
        "net": -1.5,
        "opposing_claims": [
          "DCR-C2",
          "DIN-C1"
        ],
        "opposition": 1.5,
        "option_id": "OPT-MERGE",
        "support": 0.0,
        "supporting_claims": [],
        "unmet_thresholds": [],
        "verified_evidence": 3
      },
      {
        "contradiction_penalty": 0.0,
        "distinct_evidence": 0,
        "evidence_refs": [],
        "evidence_sufficient": false,
        "independent_groups": 0,
        "label": "Split the change and ship the handler alone",
        "mean_evidence_quality": 0.0,
        "net": 0.0,
        "opposing_claims": [],
        "opposition": 0.0,
        "option_id": "OPT-SPLIT",
        "support": 0.0,
        "supporting_claims": [],
        "unmet_thresholds": [
          "requires 3 distinct evidence records, resolved 0",
          "requires 2 independent sources, resolved 0",
          "no evidence resolved for this option",
          "task class requires at least one INTEGRITY_CHECKED or AUTHORITATIVE evidence record"
        ],
        "verified_evidence": 0
      }
    ],
    "rejected_alternatives": [
      {
        "option_id": "OPT-MERGE",
        "reason": "lower evidence-weighted net score (-1.5) than the selection"
      },
      {
        "option_id": "OPT-SPLIT",
        "reason": "requires 3 distinct evidence records, resolved 0; requires 2 independent sources, resolved 0; no evidence resolved for this option; task class requires at least one INTEGRITY_CHECKED or AUTHORITATIVE evidence record"
      }
    ],
    "selected_option_id": "OPT-SCOPED",
    "selection_reason": "OPT-SCOPED carries the highest evidence-weighted net score 1.5 among options meeting the CHANGE_RISK evidence threshold",
    "thresholds_applied": {
      "min_distinct_evidence_per_option": 3,
      "min_independent_sources_per_option": 2,
      "minimum_evidence_quality": 70,
      "require_verified_evidence": true
    },
    "tie_candidates": []
  },
  "evidence_used": [
    {
      "authority": "authoritative",
      "evidence_id": "EV-D1",
      "independence_group": "ci-execution",
      "quality": 85,
      "source_type": "test_result",
      "untrusted_instruction_detected": false,
      "verification_state": "INTEGRITY_CHECKED"
    },
    {
      "authority": "authoritative",
      "evidence_id": "EV-D2",
      "independence_group": "static-analysis",
      "quality": 90,
      "source_type": "repository",
      "untrusted_instruction_detected": false,
      "verification_state": "INTEGRITY_CHECKED"
    },
    {
      "authority": "authoritative",
      "evidence_id": "EV-D3",
      "independence_group": "human-review",
      "quality": 80,
      "source_type": "human_attestation",
      "untrusted_instruction_detected": false,
      "verification_state": "AUTHORITATIVE"
    },
    {
      "authority": "corroborating",
      "evidence_id": "EV-D4",
      "independence_group": "runtime-telemetry",
      "quality": 75,
      "source_type": "measurement",
      "untrusted_instruction_detected": false,
      "verification_state": "RETRIEVED"
    },
    {
      "authority": "authoritative",
      "evidence_id": "EV-D5",
      "independence_group": "internal-standard",
      "quality": 85,
      "source_type": "document",
      "untrusted_instruction_detected": false,
      "verification_state": "AUTHORITATIVE"
    },
    {
      "authority": "corroborating",
      "evidence_id": "EV-D6",
      "independence_group": "operational-record",
      "quality": 70,
      "source_type": "measurement",
      "untrusted_instruction_detected": false,
      "verification_state": "RETRIEVED"
    }
  ],
  "execution": {
    "authorization_status": "PENDING_CASA",
    "composition_rule": "confidence never grants permission; authorization never cures insufficient evidence",
    "execution_authorized": false,
    "execution_outcome": "REVIEW",
    "recommendation_eligible": false
  },
  "gate": {